{
  "$schema": "https://json-schema.org/draft/2020-12/schema",
  "type": "object",
  "required": [
    "schema_version",
    "artifact_type",
    "functional_set",
    "accepted_predecessor",
    "design_inputs"
  ],
  "properties": {
    "schema_version": {
      "const": "1"
    },
    "artifact_type": {
      "const": "functional-set"
    },
    "functional_set": {
      "$schema": "https://json-schema.org/draft/2020-12/schema",
      "type": "object",
      "required": [
        "order",
        "id",
        "kind",
        "title",
        "description"
      ],
      "properties": {
        "order": {
          "type": "integer",
          "minimum": 0
        },
        "id": {
          "type": "string",
          "minLength": 1
        },
        "kind": {
          "type": "string",
          "minLength": 1
        },
        "title": {
          "type": "string",
          "minLength": 1
        },
        "description": {
          "type": "string",
          "minLength": 1
        }
      },
      "additionalProperties": true
    },
    "accepted_predecessor": {
      "anyOf": [
        {
          "type": "null"
        },
        {
          "type": "object",
          "required": [
            "accepted_revision"
          ],
          "properties": {
            "accepted_revision": {
              "type": "string",
              "pattern": "^[0-9a-f]{40}$"
            }
          },
          "additionalProperties": true
        }
      ]
    },
    "design_inputs": {
      "type": "array",
      "minItems": 1,
      "items": {
        "$schema": "https://json-schema.org/draft/2020-12/schema",
        "type": "object",
        "required": [
          "doc_id",
          "path",
          "statements",
          "binding"
        ],
        "properties": {
          "doc_id": {
            "type": "string",
            "pattern": "^DP-[0-9]{3}$"
          },
          "path": {
            "type": "string",
            "minLength": 1
          },
          "statements": {
            "type": "array",
            "minItems": 1,
            "items": {
              "type": "string",
              "pattern": "^DP[0-9]{3}-[A-Z][A-Z0-9-]*-[0-9]{3}$"
            },
            "uniqueItems": true
          },
          "binding": {
            "$schema": "https://json-schema.org/draft/2020-12/schema",
            "type": "object",
            "required": [
              "kind"
            ],
            "properties": {
              "kind": {
                "enum": [
                  "genesis-portable-snapshot",
                  "repository-native"
                ]
              },
              "snapshot_path": {
                "type": "string",
                "minLength": 1
              },
              "content_digest": {
                "$schema": "https://json-schema.org/draft/2020-12/schema",
                "type": "object",
                "required": [
                  "algorithm",
                  "value"
                ],
                "properties": {
                  "algorithm": {
                    "type": "string",
                    "minLength": 1
                  },
                  "value": {
                    "type": "string",
                    "minLength": 1
                  }
                },
                "additionalProperties": true
              },
              "revision": {
                "type": "string",
                "pattern": "^[0-9a-f]{40}$"
              }
            },
            "additionalProperties": true,
            "oneOf": [
              {
                "properties": {
                  "kind": {
                    "const": "genesis-portable-snapshot"
                  }
                },
                "required": [
                  "snapshot_path",
                  "content_digest"
                ]
              },
              {
                "properties": {
                  "kind": {
                    "const": "repository-native"
                  }
                },
                "required": [
                  "revision"
                ],
                "not": {
                  "anyOf": [
                    {
                      "required": [
                        "snapshot_path"
                      ]
                    },
                    {
                      "required": [
                        "content_digest"
                      ]
                    }
                  ]
                }
              }
            ]
          }
        },
        "additionalProperties": true
      }
    }
  },
  "additionalProperties": true
}
