{
  "schema_version": "1",
  "artifact_type": "functional-set",
  "functional_set": {
    "order": 1,
    "id": "FS1-EVIDENCE-FIXTURE",
    "kind": "successor",
    "title": "Successor evidence fixture",
    "description": "Minimal ordinary successor Plan used by Genesis implementation evidence."
  },
  "accepted_predecessor": {
    "accepted_revision": "3d1d280fd6822d53a57c32537fe6c8f3385beb51"
  },
  "design_inputs": [
    {
      "doc_id": "DP-001",
      "path": "repo/proposals/design-proposal.md",
      "statements": [
        "DP001-REQUIREMENTS-003"
      ],
      "binding": {
        "kind": "repository-native",
        "revision": "3d1d280fd6822d53a57c32537fe6c8f3385beb51"
      }
    }
  ]
}
